### ISSUE TITLE
[BUG] distributed 300 node ospf neighbor status stuck

### ISSUE THREAD

**Issue by JH-D** [coreemu/core#859]
**Describe the bug**
distributed, 300 node, model is router. ospf neighbor status stuck as ExStart Exchange.
```
C298# show ip ospf neighbor

    Neighbor ID Pri State           Dead Time Address         Interface            RXmtL RqstL DBsmL
10.0.133.2        1 ExStart/DROther    4.879s 10.0.136.1      eth0:10.0.136.2          0     0     0
10.1.41.2         1 Full/DROther       5.029s 10.1.42.1       eth1:10.1.42.2           0     0     0

```
```
C93# show ip ospf neighbor

    Neighbor ID Pri State           Dead Time Address         Interface            RXmtL RqstL DBsmL
10.0.132.2        1 Full/DROther       5.875s 10.0.133.1      eth0:10.0.133.2          0     0     0
10.0.48.2         1 Full/DROther       4.686s 10.0.135.2      eth1:10.0.135.1          0     0     0
10.0.136.2        1 Exchange/DROthe    4.728s 10.0.136.2      eth2:10.0.136.1         20     0   109
```

```
# vcmd -c /tmp/pycore.1/C298 -- tcpdump -i eth0  
tcpdump: verbose output suppressed, use -v[v]... for full protocol decode
listening on eth0, link-type EN10MB (Ethernet), snapshot length 262144 bytes
17:29:06.532258 IP6 fe80::216:3eff:feb1:756c > ff02::5: OSPFv3, Hello, length 40
17:29:06.622480 IP 10.0.136.2 > 224.0.0.5: OSPFv2, Hello, length 48
17:29:07.691591 IP6 fe80::216:3eff:fe3e:fe78 > fe80::216:3eff:feb1:756c: OSPFv3, LS-Update, length 316
17:29:08.086534 IP 10.0.136.2 > 224.0.0.5: OSPFv2, Database Description, length 32
17:29:08.087136 IP 10.0.136.1 > 224.0.0.5: ospf
17:29:08.148327 IP 10.0.136.1 > 224.0.0.5: OSPFv2, Hello, length 48
17:29:08.622745 IP 10.0.136.2 > 224.0.0.5: OSPFv2, Hello, length 48
17:29:08.680951 IP6 fe80::216:3eff:fe3e:fe78 > fe80::216:3eff:feb1:756c: OSPFv3, LS-Update, length 132
17:29:09.009992 IP6 fe80::216:3eff:fe3e:fe78 > fe80::216:3eff:feb1:756c: OSPFv3, LS-Update, length 1292
17:29:09.689754 IP6 fe80::216:3eff:fe3e:fe78 > fe80::216:3eff:feb1:756c: OSPFv3, LS-Update, length 260
17:29:09.763973 IP6 fe80::216:3eff:fe3e:fe78 > ff02::5: OSPFv3, Hello, length 40
17:29:10.112498 IP6 fe80::216:3eff:feb1:756c > fe80::216:3eff:fe3e:fe78: OSPFv3, Database Description, length 28
17:29:10.148483 IP 10.0.136.1 > 224.0.0.5: OSPFv2, Hello, length 48
17:29:10.433486 IP6 fe80::216:3eff:fe3e:fe78 > fe80::216:3eff:feb1:756c: OSPFv3, LS-Update, length 1116
17:29:10.623044 IP 10.0.136.2 > 224.0.0.5: OSPFv2, Hello, length 48
17:29:10.628365 IP6 fe80::216:3eff:fe3e:fe78 > fe80::216:3eff:feb1:756c: OSPFv3, LS-Update, length 476
17:29:11.080770 IP6 fe80::216:3eff:fe3e:fe78 > fe80::216:3eff:feb1:756c: OSPFv3, LS-Update, length 284
```

**To Reproduce**
1. Install 1 master server and several distributed server. Server's hardware performance is all enough good, low usage while run session.
Follow doc: https://coreemu.github.io/core/distributed.html
2. 300 node session start，model is router.
Follow example: https://github.com/coreemu/core/blob/master/package/examples/grpc/distributed_switch.py
3. About 10 minutes later, find this problem.
4. No error in core-daemon's log.

**Expected behavior**
All node's ospf neighbor status should be Full or 2-way.

**Screenshots**

**Desktop (please complete the following information):**
 - OS: Ubuntu 22.04
 - CORE Version :9.0.3
 - EMANE Version:no

**Additional context**

**Comment by bharnden** [comment]
300 is on the very high side of things. Not sure I can really tell you much here. Far too many things to account for without knowing and if it happens to be related to OSPF itself, nothing I can do.
